<?xml version="1.0" encoding="UTF-8"?>
<empresa NIF="256985125" nacionalidad="Española" xmlns:xsi="http://www.w3.org/2001/XMLSchema-instance" 
         xsi:noNamespaceSchemaLocation="Empresa.xsd">
    <nombre>Elena S.L</nombre>
    <NIF>12345678A</NIF>
    <capitalSocial>3356</capitalSocial>
    <divisaCapitalSocial>Euros</divisaCapitalSocial>
    <direccion>
        <tipoVia>Calle</tipoVia>
        <nombreVia>Bretón de los Herreros</nombreVia>
        <codigoPostal>28003</codigoPostal>
        <pais>España</pais>
    </direccion>
    <empleados>
        <empleado DNI="25698454L">
            <nombre>Elena</nombre>
            <apellidos>Fernández</apellidos>
            <apellidos>Cañizares</apellidos>
            <DNI>05316967B</DNI>
            <extranjero>false</extranjero>
            <fechaNacimiento>1999-05-12</fechaNacimiento>
            <salario>1400.78</salario>
            <direccionEmpleado>
                <pais>España</pais>
                <tipoVia>Calle</tipoVia>
                <nombreVia>Ponzano</nombreVia>
                <codigoPostal>28003</codigoPostal>
            </direccionEmpleado>
        </empleado>
        <empleado DNI="56326598K">
            <nombre>Juan</nombre>
            <apellidos>Pérez</apellidos>
            <apellidos>Hernandez</apellidos>
            <apellidos>López</apellidos>
            <DNI>0695485B</DNI>
            <extranjero>false</extranjero>
            <fechaNacimiento>1995-06-02</fechaNacimiento>
            <salario>1085.98</salario>
            <direccionEmpleado>
                <pais>España</pais>
                <tipoVia>Calle</tipoVia>
                <nombreVia>Santa Engracia</nombreVia>
                <codigoPostal>28003</codigoPostal>
            </direccionEmpleado>
            <estaCasado/>
        </empleado>
    </empleados>
</empresa>
